{
  "contract_version": "1.0",
  "operation": "verify_requirement",
  "project_id": "PROJECT-DEMO",
  "request_id": "REQUEST-verify_requirement",
  "input": {
    "target": {
      "key": "target",
      "ref": {
        "kind": "requirement_revision",
        "id": "REV-17-2",
        "state_id": "REV-17-2-v1"
      },
      "requirement_id": "REQ-17",
      "title": "Сохранять фильтры",
      "text": "Пользователь может сохранить выбранный набор фильтров.",
      "rationale": "Доработка поддержана пользовательской обратной связью.",
      "evidence": [
        {
          "finding_key": "f1",
          "links": [
            {
              "kind": "available",
              "fragment_key": "e1"
            }
          ]
        }
      ],
      "open_questions": []
    },
    "findings": [
      {
        "key": "f1",
        "ref": {
          "kind": "finding",
          "id": "FINDING-1",
          "state_id": "FINDING-1-v1"
        },
        "text": "Пользователь просит сохранять фильтры.",
        "types": [
          "request"
        ],
        "mode": "direct",
        "evidence": [
          {
            "kind": "available",
            "fragment_key": "e1"
          }
        ],
        "uncertainty_notes": [],
        "open_questions": [],
        "authorship": "ai"
      }
    ],
    "fragments": [
      {
        "key": "e1",
        "ref": {
          "kind": "fragment",
          "id": "FRAGMENT-1",
          "state_id": "FRAGMENT-1-v1"
        },
        "source_ref": {
          "kind": "feedback_source",
          "id": "SRC-1",
          "state_id": "SRC-1-v1"
        },
        "text_ref": {
          "kind": "feedback_source",
          "id": "SRC-1",
          "state_id": "SRC-1-v1"
        },
        "quote": "Хочу сохранять фильтры.",
        "locator": {
          "start": 0,
          "end": 23
        },
        "reliability": "usable"
      }
    ],
    "documents": [],
    "comparisons": [
      {
        "key": "other1",
        "ref": {
          "kind": "requirement_revision",
          "id": "REV-28-3",
          "state_id": "REV-28-3-v1"
        },
        "requirement_id": "REQ-28",
        "roles": [
          "pending_change"
        ],
        "proposal_ref": {
          "kind": "requirement_change_proposal",
          "id": "CP-28",
          "state_id": "CP-28-v1"
        },
        "title": "Сохранение фильтров",
        "text": "Пользователь может сохранить выбранный набор фильтров."
      },
      {
        "key": "current1",
        "ref": {
          "kind": "requirement_revision",
          "id": "REV-30",
          "state_id": "rev-30-v1"
        },
        "requirement_id": "REQ-30",
        "roles": [
          "current"
        ],
        "title": "Сохранение фильтров",
        "text": "Пользователь может сохранить выбранный набор фильтров."
      },
      {
        "key": "new1",
        "ref": {
          "kind": "requirement_revision",
          "id": "REV-31",
          "state_id": "rev-31-v1"
        },
        "requirement_id": "REQ-31",
        "roles": [
          "new_candidate",
          "current"
        ],
        "title": "Сохранение фильтров",
        "text": "Пользователь может сохранить выбранный набор фильтров."
      },
      {
        "key": "history1",
        "ref": {
          "kind": "requirement_revision",
          "id": "REV-32-OLD",
          "state_id": "rev-32-old"
        },
        "requirement_id": "REQ-32",
        "roles": [
          "history"
        ],
        "title": "Сохранение фильтров",
        "text": "Пользователь может сохранить выбранный набор фильтров."
      }
    ],
    "comparison_scope": {
      "extent": "project_snapshot",
      "required_keys": [
        "other1",
        "current1",
        "new1"
      ]
    },
    "previous_checks": []
  }
}
